{
  "worksheet": "WS3",
  "curriculum_status": "deployed",
  "behaviour_ontology_reference": "framework/Observable_Behaviours.json",
  "note": "Evidence opportunity map only. Observable Behaviour candidates per rubric item. No instructional learning object, domain, or competency mapping at worksheet layer.",
  "items": {
    "WS3_B1": {
      "opportunities": [
        {
          "behaviour_id": "OB_PRO_001",
          "role": "primary",
          "evidence_mode": "direct",
          "rationale": "Applies Leo's rule to classify instance 1."
        },
        {
          "behaviour_id": "OB_PRO_006",
          "role": "secondary",
          "evidence_mode": "direct",
          "rationale": "Assigns recommended/not-recommended label."
        }
      ],
      "extraction_fields": [
        "WS3_B1"
      ]
    },
    "WS3_B2": {
      "opportunities": [
        {
          "behaviour_id": "OB_PRO_001",
          "role": "primary",
          "evidence_mode": "direct",
          "rationale": "Justifies classification using feature value."
        },
        {
          "behaviour_id": "OB_STR_001",
          "role": "secondary",
          "evidence_mode": "direct",
          "rationale": "Links feature to threshold comparison in reasoning."
        }
      ],
      "extraction_fields": [
        "WS3_B2"
      ]
    },
    "WS3_B3": {
      "opportunities": [
        {
          "behaviour_id": "OB_PRO_001",
          "role": "primary",
          "evidence_mode": "direct",
          "rationale": "Applies Leo's rule to classify instance 2."
        },
        {
          "behaviour_id": "OB_PRO_006",
          "role": "secondary",
          "evidence_mode": "direct",
          "rationale": "Assigns recommended label."
        }
      ],
      "extraction_fields": [
        "WS3_B3"
      ]
    },
    "WS3_B4": {
      "opportunities": [
        {
          "behaviour_id": "OB_PRO_001",
          "role": "primary",
          "evidence_mode": "direct",
          "rationale": "Justifies recommended classification."
        },
        {
          "behaviour_id": "OB_STR_001",
          "role": "secondary",
          "evidence_mode": "direct",
          "rationale": "Threshold comparison in verbal reasoning."
        }
      ],
      "extraction_fields": [
        "WS3_B4"
      ]
    },
    "WS3_B5": {
      "opportunities": [
        {
          "behaviour_id": "OB_PRO_001",
          "role": "primary",
          "evidence_mode": "direct",
          "rationale": "Applies Leo's rule to classify instance 3."
        },
        {
          "behaviour_id": "OB_PRO_006",
          "role": "secondary",
          "evidence_mode": "direct",
          "rationale": "Assigns not-recommended label."
        }
      ],
      "extraction_fields": [
        "WS3_B5"
      ]
    },
    "WS3_B6": {
      "opportunities": [
        {
          "behaviour_id": "OB_PRO_001",
          "role": "primary",
          "evidence_mode": "direct",
          "rationale": "Justifies not-recommended classification."
        },
        {
          "behaviour_id": "OB_STR_001",
          "role": "secondary",
          "evidence_mode": "direct",
          "rationale": "Feature-threshold reasoning statement."
        }
      ],
      "extraction_fields": [
        "WS3_B6"
      ]
    },
    "WS3_B7": {
      "opportunities": [
        {
          "behaviour_id": "OB_PRO_007",
          "role": "primary",
          "evidence_mode": "direct",
          "rationale": "Student sets energy threshold with operator."
        },
        {
          "behaviour_id": "OB_STR_002",
          "role": "secondary",
          "evidence_mode": "direct",
          "rationale": "Threshold direction encodes split semantics."
        }
      ],
      "extraction_fields": [
        "WS3_B7"
      ]
    },
    "WS3_B8": {
      "opportunities": [
        {
          "behaviour_id": "OB_PRO_007",
          "role": "primary",
          "evidence_mode": "direct",
          "rationale": "Complementary threshold branch for energy feature."
        },
        {
          "behaviour_id": "OB_STR_002",
          "role": "secondary",
          "evidence_mode": "direct",
          "rationale": "Operator direction must pair with B7."
        }
      ],
      "extraction_fields": [
        "WS3_B8"
      ]
    }
  }
}
