{
  "worksheet": "WS1",
  "curriculum_status": "deployed",
  "behaviour_ontology_reference": "framework/Observable_Behaviours.json",
  "note": "Evidence opportunity map only. Observable Behaviour candidates per rubric item. No instructional learning object, domain, or competency mapping at worksheet layer.",
  "items": {
    "WS1_B1": {
      "opportunities": [
        {
          "behaviour_id": "OB_CON_001",
          "role": "primary",
          "evidence_mode": "direct",
          "rationale": "Uses variable/label term (değişken or etiket) in nutrition-label context."
        }
      ],
      "extraction_fields": [
        "WS1_B1"
      ]
    },
    "WS1_B2": {
      "opportunities": [
        {
          "behaviour_id": "OB_CON_001",
          "role": "primary",
          "evidence_mode": "direct",
          "rationale": "Uses object/feature term (nesne or özellik) for a food instance."
        }
      ],
      "extraction_fields": [
        "WS1_B2"
      ]
    },
    "WS1_B3": {
      "opportunities": [
        {
          "behaviour_id": "OB_CON_001",
          "role": "primary",
          "evidence_mode": "direct",
          "rationale": "Names feature term; accepts nesne|özellik or değişken|etiket equivalents."
        }
      ],
      "extraction_fields": [
        "WS1_B3"
      ]
    },
    "WS1_B4": {
      "opportunities": [
        {
          "behaviour_id": "OB_CON_001",
          "role": "primary",
          "evidence_mode": "direct",
          "rationale": "Counts features in the nutrition table."
        }
      ],
      "extraction_fields": [
        "WS1_B4"
      ]
    },
    "WS1_B5": {
      "opportunities": [
        {
          "behaviour_id": "OB_CON_001",
          "role": "primary",
          "evidence_mode": "direct",
          "rationale": "Lists nutrient feature names from the table."
        }
      ],
      "extraction_fields": [
        "WS1_B5"
      ]
    },
    "WS1_B6": {
      "opportunities": [
        {
          "behaviour_id": "OB_CON_001",
          "role": "primary",
          "evidence_mode": "direct",
          "rationale": "Identifies the example food object on the sheet."
        }
      ],
      "extraction_fields": [
        "WS1_B6"
      ]
    },
    "WS1_B7": {
      "opportunities": [
        {
          "behaviour_id": "OB_CON_001",
          "role": "primary",
          "evidence_mode": "direct",
          "rationale": "Uses label (etiket) role for recommendation outcome."
        }
      ],
      "extraction_fields": [
        "WS1_B7"
      ]
    }
  }
}
